{
  "packName": "Voiceid Too Long",
  "engine": "kokoro",
  "synthetic": true,
  "sourceRef": null,
  "voices": [
    {
      "voiceId": "aaaaaaaaaaaaaaaaaaaaaaaaaaaaaaaaaaaaaaaaaaaaaaaaaaaaaaaaaaaaaaaaa",
      "file": "aaaaaaaaaaaaaaaaaaaaaaaaaaaaaaaaaaaaaaaaaaaaaaaaaaaaaaaaaaaaaaaaa.pt"
    }
  ],
  "preview": "voiceid-too-long.preview.mp3"
}
