{
  "packName": "Over Ceiling",
  "engine": "kokoro",
  "synthetic": true,
  "sourceRef": null,
  "voices": [
    {
      "voiceId": "voice0",
      "file": "voice0.pt"
    },
    {
      "voiceId": "voice1",
      "file": "voice1.pt"
    },
    {
      "voiceId": "voice2",
      "file": "voice2.pt"
    },
    {
      "voiceId": "voice3",
      "file": "voice3.pt"
    },
    {
      "voiceId": "voice4",
      "file": "voice4.pt"
    },
    {
      "voiceId": "voice5",
      "file": "voice5.pt"
    },
    {
      "voiceId": "voice6",
      "file": "voice6.pt"
    },
    {
      "voiceId": "voice7",
      "file": "voice7.pt"
    },
    {
      "voiceId": "voice8",
      "file": "voice8.pt"
    }
  ],
  "preview": "over-ceiling.preview.mp3"
}
